X,videoId,textDisplay,textOriginal,authorDisplayName,authorProfileImageUrl,authorChannelUrl,canRate,viewerRating,likeCount,publishedAt,updatedAt,authorChannelId.value,comment_id,comment_Toxicity
38,3I0MwrU3iP0,Belief isnt truth,Belief isnt truth,JNada,https://yt3.ggpht.com/ytc/AL5GRJWfEJORbjcVr9pzEJNbZ2976prokhv2_zEvPA=s48-c-k-c0x00ffffff-no-rj,http://www.youtube.com/channel/UCbHIjVc-pmKbnUZYnSNypPw,TRUE,none,3,2021-10-30T17:12:59Z,2021-10-30T17:12:59Z,UCbHIjVc-pmKbnUZYnSNypPw,Ugwlq5Af8b-jdCoWuUJ4AaABAg,0.11192002
39,3I0MwrU3iP0,"It sounds like Nevada is turning into their neighbor California where regular people can&#39;t afford housing. It&#39;s a not a surprise that the most important thing to a Hispanic that can&#39;t speak English is immigration reform (amnesty). According to our Constitution you can&#39;t be a citizen unless you can speak, read and write English but I&#39;ll bet this guy is registered to vote in Nevada and probably California too.","It sounds like Nevada is turning into their neighbor California where regular people can't afford housing. It's a not a surprise that the most important thing to a Hispanic that can't speak English is immigration reform (amnesty). According to our Constitution you can't be a citizen unless you can speak, read and write English but I'll bet this guy is registered to vote in Nevada and probably California too.",Victor O'Neill,https://yt3.ggpht.com/ytc/AL5GRJXxa37twY2rwkbQTKiSnAyMl7wMmftDwl7ubw=s48-c-k-c0x00ffffff-no-rj,http://www.youtube.com/channel/UCec1oriN9zMhjfolsw58akw,TRUE,none,0,2021-10-30T17:10:56Z,2021-10-30T17:10:56Z,UCec1oriN9zMhjfolsw58akw,Ugxd863WC626Bm4gw2Z4AaABAg,0.21241048
40,3I0MwrU3iP0,"Las Vegas is vaccinated and wearing masks, that first jackazz doesn&#39;t speak for Nevada!","Las Vegas is vaccinated and wearing masks, that first jackazz doesn't speak for Nevada!",Accutronitis The 2nd,https://yt3.ggpht.com/ytc/AL5GRJX_WywZHH-klZ76RLv2Yei-_3NUZ7e3NR0OCAxBDQ=s48-c-k-c0x00ffffff-no-rj,http://www.youtube.com/channel/UCuSoVt0NSplcHOcfFX40D2A,TRUE,none,0,2021-10-30T15:56:23Z,2021-10-30T15:56:23Z,UCuSoVt0NSplcHOcfFX40D2A,UgzMMTeqR9a5PpB_2Al4AaABAg,0.49139655
41,3I0MwrU3iP0,Do America a favor and PLEEEASE inject yourself with alchohol. <br>I&#39;ll help you set up the IV.,"Do America a favor and PLEEEASE inject yourself with alchohol. 
I'll help you set up the IV.",Shawn Hollywood,https://yt3.ggpht.com/ytc/AL5GRJW24o8zmse-rhjyC5aTkYkwJ5VnGGrs2TliZsBP2g=s48-c-k-c0x00ffffff-no-rj,http://www.youtube.com/channel/UCxqUIRmiagpKnswz41nKtsg,TRUE,none,0,2021-10-30T15:42:58Z,2021-10-30T15:42:58Z,UCxqUIRmiagpKnswz41nKtsg,UgyuCjl66jrPLbfOjA14AaABAg,0.584095
42,3I0MwrU3iP0,As boomer generation dies we will see the mainstay of Republican power be reduced to nothing. God I can’t wait,As boomer generation dies we will see the mainstay of Republican power be reduced to nothing. God I can’t wait,Josh Barker,https://yt3.ggpht.com/ytc/AL5GRJXgn8Lf4ttlJSDnHBTiPrVtKX-hJ-lovt_lsg=s48-c-k-c0x00ffffff-no-rj,http://www.youtube.com/channel/UCyRIIZVQSpFagewwUtBUVUg,TRUE,none,0,2021-10-30T14:37:00Z,2021-10-30T14:37:00Z,UCyRIIZVQSpFagewwUtBUVUg,UgyArOBPaei5F4PV2-d4AaABAg,0.18554166
43,3I0MwrU3iP0,"The Republican-led states of Mississippi, Louisiana, Kentucky, Arkansas, West Virginia, Alabama, Oklahoma, Tennessee and South Carolina are the least educated states in the US. Predictably, US states with the highest poverty rate are the Republican-led states of Mississippi, Louisiana, Kentucky, Arkansas, West Virginia, Alabama, Oklahoma, Tennessee and South Carolina.","The Republican-led states of Mississippi, Louisiana, Kentucky, Arkansas, West Virginia, Alabama, Oklahoma, Tennessee and South Carolina are the least educated states in the US. Predictably, US states with the highest poverty rate are the Republican-led states of Mississippi, Louisiana, Kentucky, Arkansas, West Virginia, Alabama, Oklahoma, Tennessee and South Carolina.",,https://yt3.ggpht.com/ytc/AL5GRJXgNFByK-fVdjjF1h5zshBtMVAz5x_-i6SJVkX6BA=s48-c-k-c0x00ffffff-no-rj,http://www.youtube.com/channel/UCPse57euDRWsJP-jpDHRvWw,TRUE,none,11,2021-10-30T13:09:40Z,2021-10-30T13:09:40Z,UCPse57euDRWsJP-jpDHRvWw,Ugz1_MS4VHd1oNmOrsd4AaABAg,0.104795754
44,3I0MwrU3iP0,"Since 1933, the economy has grown at an annual average rate of 4.6 percent under Democratic presidents and 2.4 percent under Republicans.  The average income of Americans would be more than double its current level if the economy had grown at the Democratic rate for all of the past nine decades.  Ten of eleven U.S. recessions between 1953 and the present began under Republican presidents","Since 1933, the economy has grown at an annual average rate of 4.6 percent under Democratic presidents and 2.4 percent under Republicans.  The average income of Americans would be more than double its current level if the economy had grown at the Democratic rate for all of the past nine decades.  Ten of eleven U.S. recessions between 1953 and the present began under Republican presidents",facts_matter,https://yt3.ggpht.com/ytc/AL5GRJXgNFByK-fVdjjF1h5zshBtMVAz5x_-i6SJVkX6BA=s48-c-k-c0x00ffffff-no-rj,http://www.youtube.com/channel/UCPse57euDRWsJP-jpDHRvWw,TRUE,none,6,2021-10-30T13:08:56Z,2021-10-30T13:08:56Z,UCPse57euDRWsJP-jpDHRvWw,Ugw19ImEjBriLwbdzId4AaABAg,0.009487377
45,3I0MwrU3iP0,Democrats Build Back Better Plan Dominates 😜,Democrats Build Back Better Plan Dominates 😜,Felicia Nickerson,https://yt3.ggpht.com/ytc/AL5GRJXpZ-DXnUvlH0zHmKOuPQDGXFuux5awo0b3=s48-c-k-c0x00ffffff-no-rj,http://www.youtube.com/channel/UCvWf1Udb_xlOvHp9ivFVlPQ,TRUE,none,5,2021-10-30T12:01:23Z,2021-10-30T12:01:23Z,UCvWf1Udb_xlOvHp9ivFVlPQ,UgwdwnbroYTqfUrO8jh4AaABAg,0.07845957
46,3I0MwrU3iP0,they are such snowflakes. you can risk death or killing your family or... get vaccinated.... they prefer death until it comes knocking... then they scream and cry,they are such snowflakes. you can risk death or killing your family or... get vaccinated.... they prefer death until it comes knocking... then they scream and cry,Mace Maylion,https://yt3.ggpht.com/ytc/AL5GRJVnqDGuZ27yfvvL5HhJUv64IV6qgPg26d1YUEQErA=s48-c-k-c0x00ffffff-no-rj,http://www.youtube.com/channel/UCGjNi5rmep1mWfZkW2Bcd7w,TRUE,none,0,2021-10-30T11:04:46Z,2021-10-30T11:04:46Z,UCGjNi5rmep1mWfZkW2Bcd7w,UgxPii9SAIsTjKr3frt4AaABAg,0.50503236
47,3I0MwrU3iP0,"Social services with a safety does not cause inflation. That’s Democrat and Republican BS. Ask them if all that government welfare money we give to the oligarchs causes inflation. I didn’t hear that story tale from either party for the last 5 years. When it comes to government handouts, only the rich can receive. Everyone else has to pay, and pay, and pay and pay.  to infinity and beyond!","Social services with a safety does not cause inflation. That’s Democrat and Republican BS. Ask them if all that government welfare money we give to the oligarchs causes inflation. I didn’t hear that story tale from either party for the last 5 years. When it comes to government handouts, only the rich can receive. Everyone else has to pay, and pay, and pay and pay.  to infinity and beyond!",Bad Wolf,https://yt3.ggpht.com/ytc/AL5GRJUi7s_25CpXgR89zWC5cW88RpFjq-KqAZWMTA=s48-c-k-c0x00ffffff-no-rj,http://www.youtube.com/channel/UCVEmWwtw2hlzSTY0me2czmw,TRUE,none,0,2021-10-30T10:56:10Z,2021-10-30T10:57:18Z,UCVEmWwtw2hlzSTY0me2czmw,Ugx1YqeracK9dUBXTH94AaABAg,0.1460314
48,3I0MwrU3iP0,The Republican stench reaches here. 🤣 FEAR Of needles big boys?,The Republican stench reaches here. 🤣 FEAR Of needles big boys?,Richard MacLean,https://yt3.ggpht.com/-IqA038koQMxDlPjIFev9MfRq4ItoAwiEUM_vJoZM_8pGW5MmrgzIl7MPTYkFVaWfiAkaWXyNYo=s48-c-k-c0x00ffffff-no-rj,http://www.youtube.com/channel/UC_sQ4ZiM3Rk1aK7G21gHhyQ,TRUE,none,15,2021-10-30T10:31:48Z,2021-10-30T10:31:48Z,UC_sQ4ZiM3Rk1aK7G21gHhyQ,UgwaiQvOrMPb2BES5-V4AaABAg,0.3827457