X,videoId,textDisplay,textOriginal,authorDisplayName,authorProfileImageUrl,authorChannelUrl,canRate,viewerRating,likeCount,publishedAt,updatedAt,authorChannelId.value,comment_id,comment_Toxicity
0,3I0MwrU3iP0,Second guy couldn’t tell you the steps to the scientific method,Second guy couldn’t tell you the steps to the scientific method,R E B,https://yt3.ggpht.com/UOnuJhoeE0HD6l0pvxJ7mgjZ6090wd_gxUR7Ri_fZFHfUYZatoMFHbpUInHDc3De57aA-ZXHSg=s48-c-k-c0x00ffffff-no-rj,http://www.youtube.com/channel/UC_ZLzQhUXnNd3IZLFp11eug,TRUE,none,0,2022-10-31T21:32:44Z,2022-10-31T21:32:44Z,UC_ZLzQhUXnNd3IZLFp11eug,UgwkDkh8H0nQJ9793214AaABAg,0.033806015
1,3I0MwrU3iP0,First guy rules,First guy rules,R E B,https://yt3.ggpht.com/UOnuJhoeE0HD6l0pvxJ7mgjZ6090wd_gxUR7Ri_fZFHfUYZatoMFHbpUInHDc3De57aA-ZXHSg=s48-c-k-c0x00ffffff-no-rj,http://www.youtube.com/channel/UC_ZLzQhUXnNd3IZLFp11eug,TRUE,none,0,2022-10-31T21:32:20Z,2022-10-31T21:32:20Z,UC_ZLzQhUXnNd3IZLFp11eug,UgwrBgbbXjsFtPXu1hV4AaABAg,0.030859824
2,3I0MwrU3iP0,Trump Update!   Naw just kidding.  He is still sowing discord and misinformation in the Republic.,Trump Update!   Naw just kidding.  He is still sowing discord and misinformation in the Republic.,MrJessDancing,https://yt3.ggpht.com/ytc/AL5GRJVPX4oYuuVV1VKRugjMTCzLGvrU-Qq-2g8_yw=s48-c-k-c0x00ffffff-no-rj,http://www.youtube.com/channel/UC_C-ZLCHNq5PeKVG5adeZ9g,TRUE,none,0,2022-10-29T01:22:49Z,2022-10-29T01:22:49Z,UC_C-ZLCHNq5PeKVG5adeZ9g,UgzFu5dQg-Q9MHPn_vV4AaABAg,0.17631748
3,3I0MwrU3iP0,why are the Latinos in Nevada voting for people that are RACIST when do they start kicking you out of the country when you vote for the Republicans and they get in you&#39;ll start losing your rights when they  start deporting you it will be too late don&#39;t give them the chance AMERICA needs you not the RACIST,why are the Latinos in Nevada voting for people that are RACIST when do they start kicking you out of the country when you vote for the Republicans and they get in you'll start losing your rights when they  start deporting you it will be too late don't give them the chance AMERICA needs you not the RACIST,,https://yt3.ggpht.com/ytc/AL5GRJX4DUsKgmSFHgnPl7BGpFTc6GvIXXWNOaecqMfzXEHibjHogazWDCktvkWZlWEE=s48-c-k-c0x00ffffff-no-rj,http://www.youtube.com/channel/UCeFSyT6-KczXLU5Z-MSJlIA,TRUE,none,0,2022-10-21T18:29:31Z,2022-10-21T18:30:11Z,UCeFSyT6-KczXLU5Z-MSJlIA,Ugx99yBiG8JE2TiFh794AaABAg,0.6289369
4,3I0MwrU3iP0,Is this video.. a confirmed neurotic network?  Why?.,Is this video.. a confirmed neurotic network?  Why?.,al su,https://yt3.ggpht.com/ytc/AL5GRJXUK3pA-evFLX9X9wFOMM6brYu2M6vble_sX6KIyEs=s48-c-k-c0x00ffffff-no-rj,http://www.youtube.com/channel/UC9aM675ohZ_7g_yDLPPfHkw,TRUE,none,1,2022-01-16T08:01:06Z,2022-01-16T08:01:06Z,UC9aM675ohZ_7g_yDLPPfHkw,UgybJaBdJ1w7p-rQK4x4AaABAg,0.37073207
4,3I0MwrU3iP0,Is this video.. a confirmed neurotic network?  Why?.,Is this video.. a confirmed neurotic network?  Why?.,al su,https://yt3.ggpht.com/ytc/AL5GRJXUK3pA-evFLX9X9wFOMM6brYu2M6vble_sX6KIyEs=s48-c-k-c0x00ffffff-no-rj,http://www.youtube.com/channel/UC9aM675ohZ_7g_yDLPPfHkw,TRUE,none,1,2022-01-16T08:01:06Z,2022-01-16T08:01:06Z,UC9aM675ohZ_7g_yDLPPfHkw,UgybJaBdJ1w7p-rQK4x4AaABAg,0.37073207
4,3I0MwrU3iP0,Is this video.. a confirmed neurotic network?  Why?.,Is this video.. a confirmed neurotic network?  Why?.,al su,https://yt3.ggpht.com/ytc/AL5GRJXUK3pA-evFLX9X9wFOMM6brYu2M6vble_sX6KIyEs=s48-c-k-c0x00ffffff-no-rj,http://www.youtube.com/channel/UC9aM675ohZ_7g_yDLPPfHkw,TRUE,none,1,2022-01-16T08:01:06Z,2022-01-16T08:01:06Z,UC9aM675ohZ_7g_yDLPPfHkw,UgybJaBdJ1w7p-rQK4x4AaABAg,0.37073207
4,3I0MwrU3iP0,Is this video.. a confirmed neurotic network?  Why?.,Is this video.. a confirmed neurotic network?  Why?.,al su,https://yt3.ggpht.com/ytc/AL5GRJXUK3pA-evFLX9X9wFOMM6brYu2M6vble_sX6KIyEs=s48-c-k-c0x00ffffff-no-rj,http://www.youtube.com/channel/UC9aM675ohZ_7g_yDLPPfHkw,TRUE,none,1,2022-01-16T08:01:06Z,2022-01-16T08:01:06Z,UC9aM675ohZ_7g_yDLPPfHkw,UgybJaBdJ1w7p-rQK4x4AaABAg,0.37073207
5,3I0MwrU3iP0,Haha of your gonna stick anything in it better be alcohol 😂😂😂🙌🔥,Haha of your gonna stick anything in it better be alcohol 😂😂😂🙌🔥,robert loera,https://yt3.ggpht.com/ytc/AL5GRJXlrWZdiUpFnsOPeCSXYEnfDXFyRXFdPE7aSnBj-w=s48-c-k-c0x00ffffff-no-rj,http://www.youtube.com/channel/UC9rzK4InVvmWraQOnxTOwug,TRUE,none,0,2022-01-03T09:48:49Z,2022-01-03T09:48:49Z,UC9rzK4InVvmWraQOnxTOwug,UgxHfSEIIb1y5Ecexo14AaABAg,0.28547668
6,3I0MwrU3iP0,"&quot;Since obama&quot; and his 3rd term has caused crazy inflation like never seen before, no more socialist communist democrats... we all know that Obama is running joe kamala pelosi, all them BFF","""Since obama"" and his 3rd term has caused crazy inflation like never seen before, no more socialist communist democrats... we all know that Obama is running joe kamala pelosi, all them BFF",faithlilis,https://yt3.ggpht.com/eoZiEu8chpGMc_AfKnU6VME0E0adOrlGiMUY7jxMqt9xz6_RytXtaq-UOY0HtYt7xjCyTEltJw=s48-c-k-c0x00ffffff-no-rj,http://www.youtube.com/channel/UCMdmbp8ooIi4JJ7QYc9w__A,TRUE,none,1,2021-11-02T23:26:13Z,2021-11-02T23:45:22Z,UCMdmbp8ooIi4JJ7QYc9w__A,UgwmbmRt4FaSEUY2tIt4AaABAg,0.37576625
7,3I0MwrU3iP0,With partisan numbers so even republican covid deaths could make the difference next election.,With partisan numbers so even republican covid deaths could make the difference next election.,Sprig,https://yt3.ggpht.com/ytc/AL5GRJXX-sa082giP5hc9FK7ap5-Ntepv8YcvzjI8w=s48-c-k-c0x00ffffff-no-rj,http://www.youtube.com/channel/UC6XJkh-lqKkN8yqGpRqe-Og,TRUE,none,0,2021-11-02T23:02:31Z,2021-11-02T23:02:31Z,UC6XJkh-lqKkN8yqGpRqe-Og,UgyYOmKmDpO8pSMDzux4AaABAg,0.112746716
8,3I0MwrU3iP0,Oops wrong state back to southern Cali!,Oops wrong state back to southern Cali!,Nathan Soto,https://yt3.ggpht.com/ytc/AL5GRJXZQmXFE3Z9Ln9dHWoCiVEvCj0DVXWYk3yzvABC=s48-c-k-c0x00ffffff-no-rj,http://www.youtube.com/channel/UC3rzNkih63DzQu1-2okwFRQ,TRUE,none,1,2021-11-02T00:33:31Z,2021-11-02T00:33:31Z,UC3rzNkih63DzQu1-2okwFRQ,Ugwpm4LOsUtTxvwSi_d4AaABAg,0.11129999
9,3I0MwrU3iP0,This about weed is not I&#39;m gone sucka!,This about weed is not I'm gone sucka!,Nathan Soto,https://yt3.ggpht.com/ytc/AL5GRJXZQmXFE3Z9Ln9dHWoCiVEvCj0DVXWYk3yzvABC=s48-c-k-c0x00ffffff-no-rj,http://www.youtube.com/channel/UC3rzNkih63DzQu1-2okwFRQ,TRUE,none,1,2021-11-02T00:32:04Z,2021-11-02T00:32:17Z,UC3rzNkih63DzQu1-2okwFRQ,UgzETU9PAJ2eDxTG1Wh4AaABAg,0.78711975
10,3I0MwrU3iP0,Illegal immigrants should enjoy themselves for next three years! Then deportation!!!!!!!,Illegal immigrants should enjoy themselves for next three years! Then deportation!!!!!!!,Bob Buresh,https://yt3.ggpht.com/ytc/AL5GRJWUXFxDKsR2FyMem2AyO9Q7G196oPoK1PnGXA=s48-c-k-c0x00ffffff-no-rj,http://www.youtube.com/channel/UCTZ1jGiGxgkHxUe3Znz3BTg,TRUE,none,0,2021-11-01T18:55:53Z,2021-11-01T18:55:53Z,UCTZ1jGiGxgkHxUe3Znz3BTg,UgzlWBskMUQ_k597q5F4AaABAg,0.4574824
11,3I0MwrU3iP0,"The statement that thousands of Californians are moving to Washoe(Reno) is why this is a wildcard.  Tesla, Apple, etc, started building plants out in Sparks.  This brought in the educated, liberal, socialist leaning workers from CA with CA wages driving up housing cost, plus builder started rebuilding after the recession, plus CA folks getting priced out of CA sought these new homes with no personal income tax, plus CA baby boomers retiring, plus COVID allowed Bay Area workers to remote work as long as they are 4 hours from HQ(Silicon Valley).  This is the perfect storm in Reno.  Cultural and idealogy clashes with Californians moving to Nevada, Arizona, Washington, Oregon, Idaho have conservative locals upset. Nice to visit,  please don&#39;t stay....","The statement that thousands of Californians are moving to Washoe(Reno) is why this is a wildcard.  Tesla, Apple, etc, started building plants out in Sparks.  This brought in the educated, liberal, socialist leaning workers from CA with CA wages driving up housing cost, plus builder started rebuilding after the recession, plus CA folks getting priced out of CA sought these new homes with no personal income tax, plus CA baby boomers retiring, plus COVID allowed Bay Area workers to remote work as long as they are 4 hours from HQ(Silicon Valley).  This is the perfect storm in Reno.  Cultural and idealogy clashes with Californians moving to Nevada, Arizona, Washington, Oregon, Idaho have conservative locals upset. Nice to visit,  please don't stay....",Peter Lee,https://yt3.ggpht.com/ytc/AL5GRJU8altrjiy57blxtNCZziRQ4dNItqwRbxG-yw=s48-c-k-c0x00ffffff-no-rj,http://www.youtube.com/channel/UCxEhaqdzWv3Z1z57Up24Ksg,TRUE,none,1,2021-11-01T18:35:46Z,2021-11-01T18:35:46Z,UCxEhaqdzWv3Z1z57Up24Ksg,UgxXWAJLaPqcf33Pl-d4AaABAg,0.079250954
12,3I0MwrU3iP0,"Reno, the Biggest little shithole in America...","Reno, the Biggest little shithole in America...",Maj_Cyric,https://yt3.ggpht.com/ytc/AL5GRJXwwQHRDhuhR4JHeSjXIAXaSWCN5U7K4AVwZCzf=s48-c-k-c0x00ffffff-no-rj,http://www.youtube.com/channel/UCcn0GFmTzHESLOp96aZVFtw,TRUE,none,0,2021-11-01T17:14:04Z,2021-11-01T17:14:04Z,UCcn0GFmTzHESLOp96aZVFtw,UgxB6pPLdFbLNyF78np4AaABAg,0.76523775
13,3I0MwrU3iP0,"<a href=""https://youtu.be/5dDb2Z4vreM?list=LL"">https://youtu.be/5dDb2Z4vreM?list=LL</a>",https://youtu.be/5dDb2Z4vreM?list=LL,john satterlee,https://yt3.ggpht.com/ytc/AL5GRJXrz__baFQnFYhaL7pu98IMOcHT7BXUrwA5KvN8=s48-c-k-c0x00ffffff-no-rj,http://www.youtube.com/channel/UCui5LyyXthFgRIxm8s4gMYA,TRUE,none,0,2021-11-01T10:26:40Z,2021-11-01T10:26:40Z,UCui5LyyXthFgRIxm8s4gMYA,UgxH-DrbF_xij0ASOYh4AaABAg,0.011058134
14,3I0MwrU3iP0,I got same break down of Washoe county by watching Reno 911,I got same break down of Washoe county by watching Reno 911,John Farmer,https://yt3.ggpht.com/ytc/AL5GRJVgaghPBGideUzL2oTYmQBs_r0RribkXNx5Kw=s48-c-k-c0x00ffffff-no-rj,http://www.youtube.com/channel/UCJGJD4oU-coScwxZPKDoyuw,TRUE,none,1,2021-11-01T05:47:01Z,2021-11-01T05:47:01Z,UCJGJD4oU-coScwxZPKDoyuw,UgzTIqOTSl-WuaapYy54AaABAg,0.017592486
15,3I0MwrU3iP0,"AMERICAN PANDEMIC &amp; ANTI-VAXXERS ARE AN INTERNATIONAL JOKE.
<br>Population:      US 333M       NZ 5M   American population is 66 times larger than New Zealand. 
<br>Covid deaths:  US 766,266   NZ 28    American Covid deaths is 27,366 times larger than New Zealand.
<br>WTF:                 US parents protest about?         A: 184 school shootings in 10 years                B: Masks.","AMERICAN PANDEMIC & ANTI-VAXXERS ARE AN INTERNATIONAL JOKE.
Population:      US 333M       NZ 5M   American population is 66 times larger than New Zealand. 
Covid deaths:  US 766,266   NZ 28    American Covid deaths is 27,366 times larger than New Zealand.
WTF:                 US parents protest about?         A: 184 school shootings in 10 years                B: Masks.",DJ Pomare,https://yt3.ggpht.com/j1WLdrLMXrcysMGaUbgVfeGyXpdl7_FvY_tRo5o4ZKghIrnbr8jGiGJsa0QJVZB53dHsKVfVtIY=s48-c-k-c0x00ffffff-no-rj,http://www.youtube.com/channel/UCRWmvf_zTupcfkUuPfoIjDg,TRUE,none,0,2021-10-31T23:10:31Z,2021-10-31T23:10:31Z,UCRWmvf_zTupcfkUuPfoIjDg,Ugy90NCUTbJlDEj2Jdx4AaABAg,0.42129645
16,3I0MwrU3iP0,"Be FREE 🇺🇸<br>STAND YOUR GROUND.<br>Government does not control us, we control the government as free Americans.<br>No dictatorship.<br>Blessings to you &amp; yours in everyway 🙏<br>Trust in God not a man made depopulation program 🕵️‍♂️🙏","Be FREE 🇺🇸
STAND YOUR GROUND.
Government does not control us, we control the government as free Americans.
No dictatorship.
Blessings to you & yours in everyway 🙏
Trust in God not a man made depopulation program 🕵️‍♂️🙏",God sent Me 🙏,https://yt3.ggpht.com/3S9b6bByFVnrNbO6uUAyfM2QRWwyuw9A8PPU9ZHyWpYyXuN5sgysPiu1sC_tM659gEjFD37_fA=s48-c-k-c0x00ffffff-no-rj,http://www.youtube.com/channel/UCMcxhJKGbSPiLf__-9c9RuQ,TRUE,none,1,2021-10-31T22:16:39Z,2021-10-31T22:16:39Z,UCMcxhJKGbSPiLf__-9c9RuQ,Ugy-IjciCnzvcVJNIN14AaABAg,0.112436704
17,3I0MwrU3iP0,"Don&#39;t u Dems voters forget Hunter needs ur money for the low low price of 500,000 u too can buy some of his stick figure paints.","Don't u Dems voters forget Hunter needs ur money for the low low price of 500,000 u too can buy some of his stick figure paints.",Shane Haggard,https://yt3.ggpht.com/ytc/AL5GRJXpwx-w896xGkfe3JbcaMh9FUk234NsnME33Q=s48-c-k-c0x00ffffff-no-rj,http://www.youtube.com/channel/UCnJnPCg078TdrUlxT9X9C3w,TRUE,none,0,2021-10-31T19:52:24Z,2021-10-31T19:52:24Z,UCnJnPCg078TdrUlxT9X9C3w,UgwOQDTmTFt8bp7I3_V4AaABAg,0.2396185
18,3I0MwrU3iP0,My problem with Republicans in general is they have no problem raising national debt for 2 endless wars for big oil profits. With an estimated 6 trillion price tag with interest.,My problem with Republicans in general is they have no problem raising national debt for 2 endless wars for big oil profits. With an estimated 6 trillion price tag with interest.,Co2112,https://yt3.ggpht.com/ytc/AL5GRJUoHCh-AXfY509Zh5f41tXn_47b-Rx6YM67-A=s48-c-k-c0x00ffffff-no-rj,http://www.youtube.com/channel/UCk9m99KtIc23aQ4fp3nrIAw,TRUE,none,1,2021-10-31T17:48:55Z,2021-10-31T17:48:55Z,UCk9m99KtIc23aQ4fp3nrIAw,Ugx3_M3y8IDEICvQKqJ4AaABAg,0.04315203
19,3I0MwrU3iP0,Democratic Party is trying to bring America 🇺🇸down into Bankruptcy!!!,Democratic Party is trying to bring America 🇺🇸down into Bankruptcy!!!,greensmash,https://yt3.ggpht.com/ytc/AL5GRJVSSYvHqCyz5ZrvqxKbCRRADLJM9cD5bXCePA=s48-c-k-c0x00ffffff-no-rj,http://www.youtube.com/channel/UCidO-FvZVP7qrsPsCE6Kk-g,TRUE,none,0,2021-10-31T17:47:04Z,2021-10-31T17:47:04Z,UCidO-FvZVP7qrsPsCE6Kk-g,UgwrECu2cK601dS7Ilh4AaABAg,0.1798404
20,3I0MwrU3iP0,"If you want affordable housing, best not turn to the Republican Party thinking you&#39;ll get it.","If you want affordable housing, best not turn to the Republican Party thinking you'll get it.",,https://yt3.ggpht.com/ytc/AL5GRJWWHwQBCIbTnsCItcCicCZyTr8RiMMQ4t_mcA9Bx4g=s48-c-k-c0x00ffffff-no-rj,http://www.youtube.com/channel/UC9Tr8TXWRLAiNNyHiUzioyw,TRUE,none,0,2021-10-31T16:39:50Z,2021-10-31T16:39:50Z,UC9Tr8TXWRLAiNNyHiUzioyw,UgwtcVY7gRLPxUJ2Ne14AaABAg,0.11119666
21,3I0MwrU3iP0,"There are willfully ignorant and stubbornly self-involved people everywhere, and Nevada is no exception.","There are willfully ignorant and stubbornly self-involved people everywhere, and Nevada is no exception.",SourDoughBill,https://yt3.ggpht.com/ytc/AL5GRJWWHwQBCIbTnsCItcCicCZyTr8RiMMQ4t_mcA9Bx4g=s48-c-k-c0x00ffffff-no-rj,http://www.youtube.com/channel/UC9Tr8TXWRLAiNNyHiUzioyw,TRUE,none,2,2021-10-31T16:34:35Z,2021-10-31T16:36:27Z,UC9Tr8TXWRLAiNNyHiUzioyw,UgzeaJjIr9oaceGdIoh4AaABAg,0.5721988
22,3I0MwrU3iP0,I&#39;ll speak out about a GOP that tried 72 times to take healthcare away from 40 million americans millions of people going through treatment for cancer and other ailments and others with preexisting medical conditions. The republicans are just evil.,I'll speak out about a GOP that tried 72 times to take healthcare away from 40 million americans millions of people going through treatment for cancer and other ailments and others with preexisting medical conditions. The republicans are just evil.,Joe Earley,https://yt3.ggpht.com/ytc/AL5GRJUvf162u7w2_IxBGZ4R_THWlIilzRMxIFnrfA=s48-c-k-c0x00ffffff-no-rj,http://www.youtube.com/channel/UCSBwqj77geNXxZ60VtgGq8A,TRUE,none,0,2021-10-31T15:49:44Z,2021-10-31T15:49:44Z,UCSBwqj77geNXxZ60VtgGq8A,UgxUlfZFgjUFJkGnISd4AaABAg,0.51980776
23,3I0MwrU3iP0,wow not many ppl watching these news channels anymore most not be able to hide view count,wow not many ppl watching these news channels anymore most not be able to hide view count,James F.,https://yt3.ggpht.com/ytc/AL5GRJVdnOjA1HkEqbUkCyubi2EvlHJg7mvscL5ZnQ=s48-c-k-c0x00ffffff-no-rj,http://www.youtube.com/channel/UCQlo2iJaVdXo-TTc-grlcXg,TRUE,none,0,2021-10-31T15:42:27Z,2021-10-31T15:42:27Z,UCQlo2iJaVdXo-TTc-grlcXg,Ugxmw1nQKTS52cqbp2Z4AaABAg,0.104361884
24,3I0MwrU3iP0,Guadalupe Venegas la gente que ya deje pedir una reforma migratoria por que no nos van a dar nada . Solo atole con el dedo es lo w que ur nos dan . En la administración Obama solo hicieron ver que hacían algo bueno por los soñadores y la demás gente que ?  Hay familias con hijos mayores de 21 años que les podrían arreglar su estatus pero tienen miedo por que los castigan mandándolos a Mexico si solo les quitaran ese castigo cuantas familias serían beneficiadas y los que pagamos siempre los platos rotos somos los mexicanos 😡 ahorita cuántos niños centro americanos vienen a tirar literalmente a la frontera los Padres y no les ponen cargos si no que Los Reubican pronto y hasta papeles les dan y los que tenemos años esperando por una reforma no nos perdonan ni una infracción de tráfico . A nivel universal no hay justicia ni igualdad  y todos los gobiernos solo ven por sus intereses . Yo estoy agradecida por las oportunidades que se me han dado en este país a pesar de que nunca quise emigrar pero aquí estoy hasta que pueda y el día que mis Circunstancias  cambien aceptaré mi realidad . Pero no es justo que esta administración le esté dando menos importancia a las personas que ya estamos aquí por décadas y a las caravanas que vienen en camino si  les dan más priodidad . Me da risteza e impotencia con los gobiernos la administración pasada no nos quería u esta nueva administración pretende que nos quiere pero no toma acción por ni reforma ni nada de nada.,Guadalupe Venegas la gente que ya deje pedir una reforma migratoria por que no nos van a dar nada . Solo atole con el dedo es lo w que ur nos dan . En la administración Obama solo hicieron ver que hacían algo bueno por los soñadores y la demás gente que ?  Hay familias con hijos mayores de 21 años que les podrían arreglar su estatus pero tienen miedo por que los castigan mandándolos a Mexico si solo les quitaran ese castigo cuantas familias serían beneficiadas y los que pagamos siempre los platos rotos somos los mexicanos 😡 ahorita cuántos niños centro americanos vienen a tirar literalmente a la frontera los Padres y no les ponen cargos si no que Los Reubican pronto y hasta papeles les dan y los que tenemos años esperando por una reforma no nos perdonan ni una infracción de tráfico . A nivel universal no hay justicia ni igualdad  y todos los gobiernos solo ven por sus intereses . Yo estoy agradecida por las oportunidades que se me han dado en este país a pesar de que nunca quise emigrar pero aquí estoy hasta que pueda y el día que mis Circunstancias  cambien aceptaré mi realidad . Pero no es justo que esta administración le esté dando menos importancia a las personas que ya estamos aquí por décadas y a las caravanas que vienen en camino si  les dan más priodidad . Me da risteza e impotencia con los gobiernos la administración pasada no nos quería u esta nueva administración pretende que nos quiere pero no toma acción por ni reforma ni nada de nada.,Maria Luisa Mendoza,https://yt3.ggpht.com/qvzuRE8tAbTsxyNo9NAw1DXR0OyOo8p5SlfwAjcUNXsuXs6RHvf3K0ojStkCDgrkBOvu0cuB=s48-c-k-c0x00ffffff-no-rj,http://www.youtube.com/channel/UC6efYgw0M0pkB_CZ_W3kt3g,TRUE,none,0,2021-10-31T15:04:46Z,2021-10-31T15:04:46Z,UC6efYgw0M0pkB_CZ_W3kt3g,Ugwl3H-qyf2J4C3UoYl4AaABAg,0.21776234
25,3I0MwrU3iP0,"Trump the American people rejected you! And we will again,and again, and again. Trump lost the election just like he looses all his court cases. He is the biggest loser!","Trump the American people rejected you! And we will again,and again, and again. Trump lost the election just like he looses all his court cases. He is the biggest loser!",Mark Jeffreys,https://yt3.ggpht.com/qYM_-uBT6TagykJkiegleHFQEBziUmeHl2HrCHIzCoUtll9gUDRqAxl8vG2QgIEzvOeUc1fJQg=s48-c-k-c0x00ffffff-no-rj,http://www.youtube.com/channel/UCGEM4xKhbxfjeP4R9F61b0w,TRUE,none,0,2021-10-31T12:12:23Z,2021-10-31T12:12:23Z,UCGEM4xKhbxfjeP4R9F61b0w,Ugy-sGF-yWP1MOczaOB4AaABAg,0.6491204
26,3I0MwrU3iP0,america the dumb,america the dumb,Thomas Head,https://yt3.ggpht.com/ytc/AL5GRJX6xdPX2zEaHOqqsVnTI7P2DW1LXvBsWfM3zone4w=s48-c-k-c0x00ffffff-no-rj,http://www.youtube.com/channel/UCp8pCqeT0qkkY2SXM9pbSVg,TRUE,none,0,2021-10-31T10:36:53Z,2021-10-31T10:36:53Z,UCp8pCqeT0qkkY2SXM9pbSVg,Ugypt-Z2JjxUAHGrtOl4AaABAg,0.65996873
26,3I0MwrU3iP0,america the dumb,america the dumb,Thomas Head,https://yt3.ggpht.com/ytc/AL5GRJX6xdPX2zEaHOqqsVnTI7P2DW1LXvBsWfM3zone4w=s48-c-k-c0x00ffffff-no-rj,http://www.youtube.com/channel/UCp8pCqeT0qkkY2SXM9pbSVg,TRUE,none,0,2021-10-31T10:36:53Z,2021-10-31T10:36:53Z,UCp8pCqeT0qkkY2SXM9pbSVg,Ugypt-Z2JjxUAHGrtOl4AaABAg,0.65996873
27,3I0MwrU3iP0,Gross,Gross,DIP-HOUSE.COM,https://yt3.ggpht.com/ytc/AL5GRJX_MRUApH8uMfABGiXazEFFKQbZRXf1Ih0s6FQC=s48-c-k-c0x00ffffff-no-rj,http://www.youtube.com/channel/UCtaFRc_qbrTWEN8k0aqGV2g,TRUE,none,0,2021-10-31T02:05:02Z,2021-10-31T02:05:02Z,UCtaFRc_qbrTWEN8k0aqGV2g,UgzZyWs6wW3_T4wTDJ94AaABAg,0.32236105
27,3I0MwrU3iP0,Gross,Gross,DIP-HOUSE.COM,https://yt3.ggpht.com/ytc/AL5GRJX_MRUApH8uMfABGiXazEFFKQbZRXf1Ih0s6FQC=s48-c-k-c0x00ffffff-no-rj,http://www.youtube.com/channel/UCtaFRc_qbrTWEN8k0aqGV2g,TRUE,none,0,2021-10-31T02:05:02Z,2021-10-31T02:05:02Z,UCtaFRc_qbrTWEN8k0aqGV2g,UgzZyWs6wW3_T4wTDJ94AaABAg,0.32236105
28,3I0MwrU3iP0,LET’S GO brandon!,LET’S GO brandon!,Mage,https://yt3.ggpht.com/ytc/AL5GRJX-cwPYJsQuUty378gRHlRxzQTLoTjzu8xA_mZH=s48-c-k-c0x00ffffff-no-rj,http://www.youtube.com/channel/UCVj_bbtACx171opDtBZtJOA,TRUE,none,2,2021-10-31T01:51:46Z,2021-10-31T01:51:46Z,UCVj_bbtACx171opDtBZtJOA,Ugyv6dkSz6R5T9IZ05Z4AaABAg,0.012503231
29,3I0MwrU3iP0,😳😳DO NOT VACCINATE YOUR CHILDREN!!!   THEY 💯 WILL END UP WITH HEART ❤️ ISSUES.,😳😳DO NOT VACCINATE YOUR CHILDREN!!!   THEY 💯 WILL END UP WITH HEART ❤️ ISSUES.,greensmash,https://yt3.ggpht.com/ytc/AL5GRJVSSYvHqCyz5ZrvqxKbCRRADLJM9cD5bXCePA=s48-c-k-c0x00ffffff-no-rj,http://www.youtube.com/channel/UCidO-FvZVP7qrsPsCE6Kk-g,TRUE,none,2,2021-10-30T23:36:51Z,2021-10-30T23:36:51Z,UCidO-FvZVP7qrsPsCE6Kk-g,UgwPWwYznALXnk65KJd4AaABAg,0.20056234
30,3I0MwrU3iP0,&quot;I dont  believe in science!&quot;....I&#39;m sick Doctor help me!!!  DOCTOR: But you dont believe in science i cant treat you because i dont believe in idiots 🤣🤣🤣🤣🤣🤣🤣!!,"""I dont  believe in science!""....I'm sick Doctor help me!!!  DOCTOR: But you dont believe in science i cant treat you because i dont believe in idiots 🤣🤣🤣🤣🤣🤣🤣!!",Chari,https://yt3.ggpht.com/ytc/AL5GRJXyGw_k7flIqabCfFVrN9se9Bj_2rKy7lB1eprN=s48-c-k-c0x00ffffff-no-rj,http://www.youtube.com/channel/UCazZj7hUZkn0yVWXY6tXKcw,TRUE,none,13,2021-10-30T22:38:02Z,2021-10-30T22:39:05Z,UCazZj7hUZkn0yVWXY6tXKcw,UgwQtmvVLVic--kcZGt4AaABAg,0.78711975
31,3I0MwrU3iP0,"This piece has nothing to do with Nevada County, CALIFORNIA!","This piece has nothing to do with Nevada County, CALIFORNIA!",Mary Ann Westgard,https://yt3.ggpht.com/ytc/AL5GRJVgdQfUkTO0zq9pjNhQCEZMnxVwe2bb-xW3gw=s48-c-k-c0x00ffffff-no-rj,http://www.youtube.com/channel/UCKvHov-6y4KZl2312TwAM7Q,TRUE,none,4,2021-10-30T22:10:22Z,2021-10-30T22:10:22Z,UCKvHov-6y4KZl2312TwAM7Q,Ugz-RvuFnMaPKZ1zgn54AaABAg,0.022139108
32,3I0MwrU3iP0,Just make sure I&#39;m wearing a mask so I don&#39;t give you COVID,Just make sure I'm wearing a mask so I don't give you COVID,Sergio Magana,https://yt3.ggpht.com/ytc/AL5GRJXxNfjT-EIOfPyyNSCgQGiqIFHI2HlE_GLCijNubIpdw9BW3Ao7SGFPFKYA2h74=s48-c-k-c0x00ffffff-no-rj,http://www.youtube.com/channel/UCimuwQ7azc_GvLu09wcEeIw,TRUE,none,2,2021-10-30T20:30:54Z,2021-10-30T20:30:54Z,UCimuwQ7azc_GvLu09wcEeIw,UgxQxHMN7ZBbMXku25Z4AaABAg,0.36867723
33,3I0MwrU3iP0,Talk about inflation when people are paying 2k for all sorts of pollution and in a cramped area.,Talk about inflation when people are paying 2k for all sorts of pollution and in a cramped area.,Frank Castle,https://yt3.ggpht.com/ytc/AL5GRJWFpIuuiopI0n3SUd71qxr-kHf3JwCPePjjt88aAA=s48-c-k-c0x00ffffff-no-rj,http://www.youtube.com/channel/UCGIkcV_I4w-A_cyb4Q9JUCg,TRUE,none,0,2021-10-30T18:31:59Z,2021-10-30T18:31:59Z,UCGIkcV_I4w-A_cyb4Q9JUCg,Ugzg6J7JhVmUpONT2sF4AaABAg,0.04760506
34,3I0MwrU3iP0,I am somehow very happy not living in the USA.,I am somehow very happy not living in the USA.,K. Vuong,https://yt3.ggpht.com/ytc/AL5GRJVK6VLZA-F1fPqkQb0cQRTOmHbR9xG1OjOLjg=s48-c-k-c0x00ffffff-no-rj,http://www.youtube.com/channel/UC_A7K5Uc7332-mVIVr6_Q1w,TRUE,none,7,2021-10-30T18:31:57Z,2021-10-30T18:31:57Z,UC_A7K5Uc7332-mVIVr6_Q1w,UgxMBv6UEzQemRnxT-x4AaABAg,0.25462922
35,3I0MwrU3iP0,Washout Co. Is FREEZING in the WINTER and FRIES in the summer. And Burners come through every year.,Washout Co. Is FREEZING in the WINTER and FRIES in the summer. And Burners come through every year.,Pohaku Mana,https://yt3.ggpht.com/ytc/AL5GRJXSd-IBe60dd9AjSEQ38nUxgM0Vix9NlkmrmeYi=s48-c-k-c0x00ffffff-no-rj,http://www.youtube.com/channel/UCl9CgvbvGFCn7NkCZ5c_yZA,TRUE,none,2,2021-10-30T17:33:00Z,2021-10-30T17:33:00Z,UCl9CgvbvGFCn7NkCZ5c_yZA,Ugyg-DYVC5VB2VF4JMJ4AaABAg,0.02308189
36,3I0MwrU3iP0,You have to be stupid to begin with to live in Nevada.,You have to be stupid to begin with to live in Nevada.,Pohaku Mana,https://yt3.ggpht.com/ytc/AL5GRJXSd-IBe60dd9AjSEQ38nUxgM0Vix9NlkmrmeYi=s48-c-k-c0x00ffffff-no-rj,http://www.youtube.com/channel/UCl9CgvbvGFCn7NkCZ5c_yZA,TRUE,none,0,2021-10-30T17:30:20Z,2021-10-30T17:30:20Z,UCl9CgvbvGFCn7NkCZ5c_yZA,UgwmkfKAZ9-z7q2X6ah4AaABAg,0.85333383
37,3I0MwrU3iP0,"Vote democrat. Only they know what&#39;s best for you, a mere adult.","Vote democrat. Only they know what's best for you, a mere adult.",Ricardo d'savant,https://yt3.ggpht.com/ytc/AL5GRJVw0ag7c4CxNI8zC2iDILH037NuKA8Bse4FEH7P=s48-c-k-c0x00ffffff-no-rj,http://www.youtube.com/channel/UCvXrBe-9HXoB1SGHaUxbn5A,TRUE,none,1,2021-10-30T17:21:18Z,2021-10-30T17:21:18Z,UCvXrBe-9HXoB1SGHaUxbn5A,UgyLQ0B3V1HZiCEkiW54AaABAg,0.25462922
